{
  "recordType": "zwleiMurrekTransitEngineeringProfile",
  "recordVersion": "1.0.0",
  "authority": {
    "status": "MIXED",
    "precedence": [
      "specific named Mur'rek vessel/class source",
      "specific confirmed Black Light family/operator canon",
      "BLACK_LIGHT_PROPULSION_TRANSIT_AUTHORITY.md",
      "ftl-civilization-engineering-doctrine.json",
      "cross-family comparative authority",
      "labeled derivation",
      "labeled proposal"
    ],
    "sources": [
      "blacklight-archive-zwlei-murrek-no-return-signal-derelict.html",
      "docs/blacklight/BLACK_LIGHT_PROPULSION_TRANSIT_AUTHORITY.md",
      "data/exo-vessel/ftl-civilization-engineering-doctrine.json",
      "data/exo-vessel/ftl-cross-family-integration-registry.json"
    ],
    "sourceDocument": "The different lightspeed methods",
    "sourceDocumentId": "1e0Xp71EFubBZgXWjjvPxAqPoJIZNwqS6nu1-r7Kil7Y",
    "rule": "The named Mur'rek source outranks generic generator assumptions. Its wording is preserved exactly enough to support engineering reconstruction, but 'gravitic slipstream' is not automatically normalized to either the gravitic-plane or slipstream-shear Black Light family without an explicit source establishing that equivalence."
  },
  "subject": {
    "civilizationOrSpecies": "Zwlei Frog Men",
    "vesselClass": "Mur'rek-class patrol frigate",
    "role": [
      "reconnaissance",
      "border monitoring",
      "ecological observation",
      "diplomacy",
      "controlled defensive withdrawal"
    ],
    "environment": "warm humid wet-deck mixed atmosphere with shallow circulation channels",
    "sourceStatus": "CONFIRMED"
  },
  "confirmedInstallation": {
    "sourceTerm": "bio-reactive gravitic slipstream system",
    "sourceStatus": "CONFIRMED",
    "documentedFunctions": [
      "non-FTL cruise",
      "station keeping optimized for low signature",
      "efficient maneuvering",
      "short-range slipstream operation",
      "inertial and gravitic condition shaping"
    ],
    "documentedComponents": [
      {
        "name": "Gravitic Slipstream Regulator",
        "status": "CONFIRMED",
        "embodiment": "flexible field vanes immersed in dielectric fluid",
        "function": "shapes inertial and gravitic conditions for maneuvering and short-range slipstream operation"
      },
      {
        "name": "Navigation Current Well",
        "status": "CONFIRMED",
        "embodiment": "course solutions represented as moving currents whose speed, depth, and interference encode vector, gravity, and transit risk",
        "function": "gravitic reference, slipstream prediction, inertial control"
      },
      {
        "name": "Vital Fluids / Power Manifold",
        "status": "CONFIRMED",
        "embodiment": "distribution nexus for conductive coolant, bio-reactive power fluids, nutrient media, and hydraulic control pressure",
        "function": "power and working-media distribution"
      },
      {
        "name": "Forward Sensor Ampulla",
        "status": "CONFIRMED",
        "embodiment": "clear gel and organic transducers",
        "function": "long-baseline observation, target ranging, spectroscopy, and passive listening"
      },
      {
        "name": "Sensor Choir Alcove",
        "status": "CONFIRMED",
        "embodiment": "relational multisensor station",
        "function": "electromagnetic, gravitic, chemical, acoustic, and exotic sensor fusion"
      },
      {
        "name": "Communications Bladder",
        "status": "CONFIRMED",
        "embodiment": "pressure-regulated resonant wall membranes",
        "function": "subspace and conventional communications"
      }
    ],
    "documentedControls": [
      "pressure-sensitive communal command basin",
      "shared tactical and stellar model",
      "moving-current navigation representation",
      "flexible field-vane control",
      "command arbitration",
      "emergency lockout and isolation mechanisms"
    ],
    "documentedSensors": [
      "electromagnetic",
      "gravitic",
      "chemical",
      "acoustic",
      "exotic observations",
      "long-baseline ranging",
      "spectroscopy",
      "passive listening"
    ],
    "documentedPowerAndMedia": [
      "conductive coolant",
      "bio-reactive power fluids",
      "nutrient media",
      "hydraulic control pressure",
      "dielectric fluid around field vanes"
    ],
    "documentedFailureHazards": [
      "asymmetric vane response can rotate the local inertial frame",
      "mixed vital fluids can create corrosive electrically active foam",
      "forward sensor ampulla is comparatively fragile and isolates first under fire",
      "abandoned hardware cannot be assumed inert merely because shipwide functions are offline"
    ]
  },
  "familyResolution": {
    "status": "UNRESOLVED",
    "reason": "The named source confirms a 'bio-reactive gravitic slipstream system' and 'short-range slipstream operation' but does not explicitly identify the consolidated Black Light family key. The phrase combines gravitic and slipstream vocabulary that belong to distinct confirmed family operators elsewhere in the corpus; normalization would therefore be an attribution, not transcription.",
    "admissibleComparisons": [
      "slipstream-shear: compare boundary/shear coupling, adhesion, detachment, Q-space/weather and wake evidence",
      "gravitic-plane: compare geodesic/equipotential riding, shear forks, recoupling, gravitational terrain and gradient evidence",
      "hybrid or installation-local control layer: consider that gravitic/inertial shaping may support a slipstream operator without being the transit operator itself",
      "short-range non-FTL or transitional effect: preserve the possibility that 'slipstream' in this source is a local vessel term rather than the full interstellar FTL family"
    ],
    "forbiddenPromotion": [
      "Do not set familyId to slipstream-shear solely because the source contains the word slipstream.",
      "Do not set familyId to gravitic-plane solely because the source describes gravitic shaping.",
      "Do not claim the Zwlei invented either family.",
      "Do not infer classwide interstellar range from short-range slipstream wording.",
      "Do not turn the derelict variant's surviving compartments into proof that every intact Mur'rek has identical damage-state behavior."
    ]
  },
  "engineeringModel": {
    "machinery": {
      "status": "MIXED",
      "confirmed": [
        "flexible field vanes immersed in dielectric fluid",
        "wet-deck living-polymer composite and flexible synthetic load frames",
        "bio-reactive fluid distribution",
        "gravitic/inertial regulator",
        "navigation current well",
        "organic sensor ampulla",
        "multimodal sensor choir"
      ],
      "derived": [
        "The installation should be modeled as a coupled fluidic-field machine rather than a dry electromechanical engine.",
        "Field-vane health, dielectric condition, fluid chemistry, gravitic reference quality, and structural alignment are independent readiness dimensions.",
        "The machinery likely requires distributed isolation because a local vane asymmetry can alter the local inertial frame before whole-drive failure occurs."
      ]
    },
    "power": {
      "status": "MIXED",
      "confirmed": "Bio-reactive power fluids, conductive coolant, nutrient media, and hydraulic pressure share the documented vital-fluids distribution nexus.",
      "derivedEquation": "R_P = min(P_bio/P_req, Q_cool/Q_req, H_hyd/H_req, N_met/N_req)",
      "derivedRule": "A high energy reserve does not certify the regulator if cooling, hydraulic authority, or biological/metabolic support is below its required margin."
    },
    "navigation": {
      "status": "MIXED",
      "confirmed": "The Navigation Current Well represents course solutions as moving currents whose speed, depth, and interference encode vector, gravity, and transit risk; its primary systems include gravitic reference, slipstream prediction, and inertial control.",
      "derivedModel": "C_nav = F(v, g, grad_g, sigma_sensor, sigma_model, vane_state, medium_state)",
      "sourceAlignment": "This directly supports the 'different lightspeed methods' requirement that transit safety margins depend on gravity, prediction quality, and family-specific sensor packages, but it does not by itself establish which consolidated FTL family performs the transit."
    },
    "control": {
      "status": "MIXED",
      "confirmed": "Control is embodied through pressure-sensitive communal interfaces, moving-current navigation representation, flexible field vanes, command arbitration, and isolation/lockout systems.",
      "derivedRule": "Control authority should be modeled as distributed state regulation across vane geometry, working-fluid state, inertial reference, gravitic reference, and command authorization rather than as a single throttle scalar."
    },
    "maintenance": {
      "status": "DERIVED",
      "serviceClasses": [
        "field-vane geometry and compliance inspection",
        "dielectric-fluid contamination and breakdown testing",
        "bio-reactive power-fluid chemistry",
        "conductive coolant isolation",
        "nutrient-media viability",
        "hydraulic pressure proof",
        "gravitic-reference calibration",
        "sensor-ampulla integrity",
        "navigation-current calibration",
        "living repair-film and membrane condition"
      ],
      "rule": "Repair that restores living material does not automatically restore regulator calibration; geometry, dielectric state, reference alignment, and vane symmetry require recertification."
    },
    "signature": {
      "status": "MIXED",
      "confirmed": "The vessel's non-FTL cruise and station keeping are optimized for low signature.",
      "derivedVector": "S_M = [S_EM,S_thermal,S_grav,S_chem,S_acoustic,S_subspace,S_wake,S_bio]",